[
  {
    "vehicle_id": "kia-ev6-2026",
    "field": "recalls.campaign_count",
    "value": 0,
    "tier": "P",
    "source_name": "NHTSA recall flat file FLAT_RCL_POST_2010 (MY2026 search)",
    "source_url": "https://static.nhtsa.gov/odi/ffdd/rcl/FLAT_RCL_POST_2010.zip",
    "access_date": "2026-09-29",
    "confidence": "medium",
    "notes": "No MY2026 records for this nameplate in NHTSA's recall flat file (file dated 2026-09-29; searched MODELTXT by regex, not exact string). The recallsByVehicle API returned HTTP 400 / Count 0 for every model string tried ('EV6'), which is how it responds to an unmatched string, so the API alone can't confirm zero."
  },
  {
    "vehicle_id": "kia-ev6-2026",
    "tier": "P",
    "source_name": "EPA/DOE fueleconomy.gov vehicle record 50215 (2026 Kia EV6 Standard Range RWD)",
    "source_url": "https://www.fueleconomy.gov/ws/rest/vehicle/50215",
    "access_date": "2026-09-29",
    "disclosed_by_oem": true,
    "confidence": "high",
    "field": "efficiency.epa_range_mi",
    "value": 237,
    "notes": "EPA id 50215, 'EV6 Standard Range RWD'. Matches the EPA bulk file (https://www.fueleconomy.gov/feg/epadata/vehicles.csv.zip). Trim choice: Entry trim."
  },
  {
    "vehicle_id": "kia-ev6-2026",
    "tier": "P",
    "source_name": "EPA/DOE fueleconomy.gov vehicle record 50215 (2026 Kia EV6 Standard Range RWD)",
    "source_url": "https://www.fueleconomy.gov/ws/rest/vehicle/50215",
    "access_date": "2026-09-29",
    "disclosed_by_oem": true,
    "confidence": "high",
    "field": "efficiency.epa_kwh_per_100mi",
    "value": 29.2248,
    "notes": "Wall-side, combined (EPA combE). The label and the printable page (https://www.fueleconomy.gov/feg/noframes/50215.shtml) round this to 29. EPA id 50215, 'EV6 Standard Range RWD'. Matches the EPA bulk file (https://www.fueleconomy.gov/feg/epadata/vehicles.csv.zip). Trim choice: Entry trim."
  },
  {
    "vehicle_id": "kia-ev6-2026",
    "tier": "P",
    "source_name": "EPA/DOE fueleconomy.gov vehicle record 50215 (2026 Kia EV6 Standard Range RWD)",
    "source_url": "https://www.fueleconomy.gov/ws/rest/vehicle/50215",
    "access_date": "2026-09-29",
    "disclosed_by_oem": true,
    "confidence": "high",
    "field": "efficiency.epa_mpge_combined",
    "value": 115,
    "notes": "EPA id 50215, 'EV6 Standard Range RWD'. Matches the EPA bulk file (https://www.fueleconomy.gov/feg/epadata/vehicles.csv.zip). Trim choice: Entry trim."
  },
  {
    "vehicle_id": "kia-ev6-2026",
    "tier": "P",
    "source_name": "EPA/DOE fueleconomy.gov vehicle record 50215 (2026 Kia EV6 Standard Range RWD)",
    "source_url": "https://www.fueleconomy.gov/ws/rest/vehicle/50215",
    "access_date": "2026-09-29",
    "disclosed_by_oem": true,
    "confidence": "high",
    "field": "powertrain.drive_layout",
    "value": "RWD",
    "notes": "EPA 'drive' field: 'Rear-Wheel Drive'. EPA id 50215, 'EV6 Standard Range RWD'. Matches the EPA bulk file (https://www.fueleconomy.gov/feg/epadata/vehicles.csv.zip). Trim choice: Entry trim."
  },
  {
    "vehicle_id": "kia-ev6-2026",
    "tier": "P",
    "source_name": "EPA/DOE fueleconomy.gov vehicle record 50215 (2026 Kia EV6 Standard Range RWD)",
    "source_url": "https://www.fueleconomy.gov/ws/rest/vehicle/50215",
    "access_date": "2026-09-29",
    "disclosed_by_oem": true,
    "confidence": "high",
    "field": "powertrain.epa_motor_description",
    "value": "125  kW PMSM",
    "notes": "EPA 'evMotor' free text, verbatim. Not parsed into motor_count/motor_type: the EPA text isn't consistent enough for that (e.g. motor counts don't always match the drive layout). EPA id 50215, 'EV6 Standard Range RWD'. Matches the EPA bulk file (https://www.fueleconomy.gov/feg/epadata/vehicles.csv.zip). Trim choice: Entry trim."
  },
  {
    "vehicle_id": "kia-ev6-2026",
    "tier": "P",
    "source_name": "Kia USA 2026 EV6 specs-compare (Light RWD)",
    "source_url": "https://www.kia.com/us/en/ev6/specs-compare",
    "access_date": "2026-10-02",
    "disclosed_by_oem": true,
    "confidence": "high",
    "field": "identity.msrp_usd",
    "value": 37900,
    "notes": "Starting MSRP for Light trim. Excludes destination and handling, taxes, title, license, options, and dealer charges."
  },
  {
    "vehicle_id": "kia-ev6-2026",
    "tier": "P",
    "source_name": "Kia USA 2026 EV6 specs-compare (Light RWD)",
    "source_url": "https://www.kia.com/us/en/ev6/specs-compare",
    "access_date": "2026-10-02",
    "disclosed_by_oem": true,
    "confidence": "high",
    "field": "battery.pack_kwh",
    "value": 63.0,
    "notes": "Light: 'Drive Battery Energy' 63.0 kWh (523 V). Long Range trims list 84.0 kWh."
  },
  {
    "vehicle_id": "kia-ev6-2026",
    "tier": "P",
    "source_name": "Kia USA 2026 EV6 specs-compare (Light RWD)",
    "source_url": "https://www.kia.com/us/en/ev6/specs-compare",
    "access_date": "2026-10-02",
    "disclosed_by_oem": true,
    "confidence": "high",
    "field": "battery.pack_kwh_basis",
    "value": "unstated",
    "notes": "OEM lists 'Drive Battery Energy' without saying gross or usable."
  },
  {
    "vehicle_id": "kia-ev6-2026",
    "tier": "P",
    "source_name": "Kia USA 2026 EV6 specs-compare (Light RWD)",
    "source_url": "https://www.kia.com/us/en/ev6/specs-compare",
    "access_date": "2026-10-02",
    "disclosed_by_oem": true,
    "confidence": "high",
    "field": "charging.port_type",
    "value": "NACS",
    "notes": "North American Charging System (NACS) listed as Standard. NACS to CCS adapter available separately (ZEV states)."
  },
  {
    "vehicle_id": "kia-ev6-2026",
    "tier": "P",
    "source_name": "Kia USA 2026 EV6 specs-compare (Light RWD)",
    "source_url": "https://www.kia.com/us/en/ev6/specs-compare",
    "access_date": "2026-10-02",
    "disclosed_by_oem": true,
    "confidence": "high",
    "field": "charging.onboard_ac_kw",
    "value": 10.9,
    "notes": "Onboard Charger Power 10.9 kW for all compared trims."
  },
  {
    "vehicle_id": "kia-ev6-2026",
    "tier": "P",
    "source_name": "Kia USA 2026 EV6 specs-compare (Light RWD)",
    "source_url": "https://www.kia.com/us/en/ev6/specs-compare",
    "access_date": "2026-10-02",
    "disclosed_by_oem": true,
    "confidence": "high",
    "field": "powertrain.power_hp",
    "value": 167,
    "notes": "Motor Horsepower (SAE), RWD: 167 hp for Light (125 kW)."
  },
  {
    "vehicle_id": "kia-ev6-2026",
    "tier": "P",
    "source_name": "Kia USA 2026 EV6 specs-compare (Light RWD)",
    "source_url": "https://www.kia.com/us/en/ev6/specs-compare",
    "access_date": "2026-10-02",
    "disclosed_by_oem": true,
    "confidence": "high",
    "field": "powertrain.accel_0_60_s",
    "value": 8.3,
    "notes": "0-60 mph (sec.) from Standstill, RWD: 8.3 for Light."
  },
  {
    "vehicle_id": "kia-ev6-2026",
    "tier": "P",
    "source_name": "Kia USA 2026 EV6 specs-compare (Light RWD)",
    "source_url": "https://www.kia.com/us/en/ev6/specs-compare",
    "access_date": "2026-10-02",
    "disclosed_by_oem": true,
    "confidence": "high",
    "field": "body.curb_weight_lb",
    "value": 4132,
    "notes": "Curb Weight RWD minimum/maximum for Light is 4,132 / 4,145 lb. Value is the published minimum."
  },
  {
    "vehicle_id": "kia-ev6-2026",
    "tier": "P",
    "source_name": "Kia USA 2026 EV6 specs-compare (Light RWD)",
    "source_url": "https://www.kia.com/us/en/ev6/specs-compare",
    "access_date": "2026-10-02",
    "disclosed_by_oem": true,
    "confidence": "high",
    "field": "body.length_in",
    "value": 184.8
  },
  {
    "vehicle_id": "kia-ev6-2026",
    "tier": "P",
    "source_name": "Kia USA 2026 EV6 specs-compare (Light RWD)",
    "source_url": "https://www.kia.com/us/en/ev6/specs-compare",
    "access_date": "2026-10-02",
    "disclosed_by_oem": true,
    "confidence": "high",
    "field": "body.width_in",
    "value": 74.0,
    "notes": "Width 74.0 in for Light / Light Long Range / Wind; GT-Line listed at 74.4 in."
  },
  {
    "vehicle_id": "kia-ev6-2026",
    "tier": "P",
    "source_name": "Kia USA 2026 EV6 specs-compare (Light RWD)",
    "source_url": "https://www.kia.com/us/en/ev6/specs-compare",
    "access_date": "2026-10-02",
    "disclosed_by_oem": true,
    "confidence": "high",
    "field": "body.height_in",
    "value": 60.8
  },
  {
    "vehicle_id": "kia-ev6-2026",
    "tier": "P",
    "source_name": "Kia USA 2026 EV6 specs-compare (Light RWD)",
    "source_url": "https://www.kia.com/us/en/ev6/specs-compare",
    "access_date": "2026-10-02",
    "disclosed_by_oem": true,
    "confidence": "high",
    "field": "body.wheelbase_in",
    "value": 114.2
  },
  {
    "vehicle_id": "kia-ev6-2026",
    "field": "powertrain.torque_lbft",
    "value": 258,
    "tier": "P",
    "source_name": "Kia Media 2026 EV6 specifications (Light RWD torque)",
    "source_url": "https://www.kiamedia.com/us/en/models/ev6/2026/specifications",
    "access_date": "2026-10-03",
    "confidence": "high",
    "notes": "Torque (lb.-ft.) - RWD: 258 lb.-ft. for Light. AWD 446 lb-ft not applied."
  }
]
