[
  {
    "vehicle_id": "polestar-2-single-motor-2025",
    "tier": "P",
    "source_name": "EPA/DOE fueleconomy.gov vehicle record 48405 (2025 2025 Polestar 2 Single Motor (19 Inch Wheels))",
    "source_url": "https://www.fueleconomy.gov/ws/rest/vehicle/48405",
    "access_date": "2026-10-02",
    "disclosed_by_oem": true,
    "confidence": "high",
    "field": "efficiency.epa_range_mi",
    "value": 314,
    "notes": "EPA id 48405, '2025 Polestar 2 Single Motor (19 Inch Wheels)'. Matches the EPA bulk file (https://www.fueleconomy.gov/feg/epadata/vehicles.csv.zip). Trim choice: Entry single-motor 19in EPA configuration.."
  },
  {
    "vehicle_id": "polestar-2-single-motor-2025",
    "tier": "P",
    "source_name": "EPA/DOE fueleconomy.gov vehicle record 48405 (2025 2025 Polestar 2 Single Motor (19 Inch Wheels))",
    "source_url": "https://www.fueleconomy.gov/ws/rest/vehicle/48405",
    "access_date": "2026-10-02",
    "disclosed_by_oem": true,
    "confidence": "high",
    "field": "efficiency.epa_kwh_per_100mi",
    "value": 29.6426,
    "notes": "Wall-side, combined (EPA combE). The label rounds this. EPA id 48405, '2025 Polestar 2 Single Motor (19 Inch Wheels)'. Matches the EPA bulk file (https://www.fueleconomy.gov/feg/epadata/vehicles.csv.zip). Trim choice: Entry single-motor 19in EPA configuration.."
  },
  {
    "vehicle_id": "polestar-2-single-motor-2025",
    "tier": "P",
    "source_name": "EPA/DOE fueleconomy.gov vehicle record 48405 (2025 2025 Polestar 2 Single Motor (19 Inch Wheels))",
    "source_url": "https://www.fueleconomy.gov/ws/rest/vehicle/48405",
    "access_date": "2026-10-02",
    "disclosed_by_oem": true,
    "confidence": "high",
    "field": "efficiency.epa_mpge_combined",
    "value": 114,
    "notes": "EPA id 48405, '2025 Polestar 2 Single Motor (19 Inch Wheels)'. Matches the EPA bulk file (https://www.fueleconomy.gov/feg/epadata/vehicles.csv.zip). Trim choice: Entry single-motor 19in EPA configuration.."
  },
  {
    "vehicle_id": "polestar-2-single-motor-2025",
    "tier": "P",
    "source_name": "EPA/DOE fueleconomy.gov vehicle record 48405 (2025 2025 Polestar 2 Single Motor (19 Inch Wheels))",
    "source_url": "https://www.fueleconomy.gov/ws/rest/vehicle/48405",
    "access_date": "2026-10-02",
    "disclosed_by_oem": true,
    "confidence": "high",
    "field": "powertrain.drive_layout",
    "value": "RWD",
    "notes": "EPA 'drive' field mapped to RWD. EPA id 48405, '2025 Polestar 2 Single Motor (19 Inch Wheels)'. Matches the EPA bulk file (https://www.fueleconomy.gov/feg/epadata/vehicles.csv.zip). Trim choice: Entry single-motor 19in EPA configuration.."
  },
  {
    "vehicle_id": "polestar-2-single-motor-2025",
    "tier": "P",
    "source_name": "EPA/DOE fueleconomy.gov vehicle record 48405 (2025 2025 Polestar 2 Single Motor (19 Inch Wheels))",
    "source_url": "https://www.fueleconomy.gov/ws/rest/vehicle/48405",
    "access_date": "2026-10-02",
    "disclosed_by_oem": true,
    "confidence": "high",
    "field": "powertrain.epa_motor_description",
    "value": "185 and 220 kW PMSM",
    "notes": "EPA 'evMotor' free text, verbatim. Not parsed into motor_count/motor_type. EPA id 48405, '2025 Polestar 2 Single Motor (19 Inch Wheels)'. Matches the EPA bulk file (https://www.fueleconomy.gov/feg/epadata/vehicles.csv.zip). Trim choice: Entry single-motor 19in EPA configuration.."
  },
  {
    "vehicle_id": "polestar-2-single-motor-2025",
    "field": "recalls.campaign_count",
    "value": 0,
    "tier": "P",
    "source_name": "NHTSA Recalls API recallsByVehicle (POLESTAR 2, MY2025)",
    "source_url": "https://api.nhtsa.gov/recalls/recallsByVehicle?make=POLESTAR&model=2&modelYear=2025",
    "access_date": "2026-10-02",
    "confidence": "medium",
    "notes": "API returned Count 0 with empty results for make=POLESTAR&model=2&modelYear=2025 (HTTP 200). Treated as zero campaigns for this query string; not a flat-file re-scan in this pass."
  },
  {
    "vehicle_id": "polestar-2-single-motor-2025",
    "field": "battery.pack_kwh",
    "value": 82,
    "tier": "P",
    "source_name": "Polestar 2 owner's manual: high-voltage battery (Long range Single motor)",
    "source_url": "https://www.polestar.com/us/manual/polestar-2/2024/article/7e3e6472bfc4d4edc0a801511a8737f9/",
    "access_date": "2026-10-02",
    "disclosed_by_oem": true,
    "confidence": "medium",
    "model_year": 2024,
    "notes": "Manual lists Long range Single motor: 82 kWh. Atlas row is MY2025 Single Motor 19in per EPA; pack figure from adjacent-year OEM manual."
  },
  {
    "vehicle_id": "polestar-2-single-motor-2025",
    "field": "battery.pack_kwh_basis",
    "value": "unstated",
    "tier": "P",
    "source_name": "Polestar 2 owner's manual: high-voltage battery (Long range Single motor)",
    "source_url": "https://www.polestar.com/us/manual/polestar-2/2024/article/7e3e6472bfc4d4edc0a801511a8737f9/",
    "access_date": "2026-10-02",
    "disclosed_by_oem": true,
    "confidence": "medium",
    "model_year": 2024,
    "notes": "Manual states 82 kWh without gross/usable label."
  },
  {
    "vehicle_id": "polestar-2-single-motor-2025",
    "field": "powertrain.accel_0_60_s",
    "value": 5.9,
    "tier": "S",
    "source_name": "Polestar UK Polestar 2 specifications: Long range Single motor 0-60",
    "source_url": "https://www.polestar.com/uk/polestar-2/specifications/",
    "access_date": "2026-10-02",
    "disclosed_by_oem": true,
    "confidence": "medium",
    "notes": "UK specs: Long range Single motor 0-60 mph 5.9 seconds. Atlas row is US EPA MY2025 Single Motor with 82 kWh (long-range class). UK listing; US 2025 retail dropped single-motor."
  },
  {
    "vehicle_id": "polestar-2-single-motor-2025",
    "field": "charging.peak_dc_kw",
    "value": 205,
    "tier": "S",
    "source_name": "Polestar UK Polestar 2 specifications: Long range DC charging",
    "source_url": "https://www.polestar.com/uk/polestar-2/specifications/",
    "access_date": "2026-10-02",
    "disclosed_by_oem": true,
    "confidence": "medium",
    "notes": "UK specs: Long range versions DC charging up to 205 kW (Standard range listed at 180 kW). Atlas pack claim is 82 kWh long-range class. UK listing; Type 2/CCS2 market context."
  },
  {
    "vehicle_id": "polestar-2-single-motor-2025",
    "field": "body.curb_weight_lb",
    "value": 4429,
    "tier": "S",
    "source_name": "Polestar UK Polestar 2 specifications: Long range Single motor curb weight",
    "source_url": "https://www.polestar.com/uk/polestar-2/specifications/",
    "access_date": "2026-10-02",
    "disclosed_by_oem": true,
    "confidence": "low",
    "notes": "UK specs list curb weight 2009-2081 kg for Long range Single motor. Recorded 2,009 kg converted to 4,429 lb (lower end of range). EU curb definition; US MSRP not filled because US 2025 retail dropped single-motor."
  },
  {
    "vehicle_id": "polestar-2-single-motor-2025",
    "field": "powertrain.power_hp",
    "value": 299,
    "tier": "S",
    "source_name": "Polestar UK Polestar 2 specifications: Long range Single motor horsepower",
    "source_url": "https://www.polestar.com/uk/polestar-2/specifications/",
    "access_date": "2026-10-03",
    "confidence": "medium",
    "notes": "Long range Single motor: 220 kW / 299 hp. Matches this atlas row's 82 kWh long-range pack and existing UK-page 0-60 claim. Standard range Single motor 272 hp not applied."
  },
  {
    "vehicle_id": "polestar-2-single-motor-2025",
    "field": "powertrain.torque_lbft",
    "value": 361,
    "tier": "S",
    "source_name": "Polestar UK Polestar 2 specifications: Long range Single motor torque",
    "source_url": "https://www.polestar.com/uk/polestar-2/specifications/",
    "access_date": "2026-10-03",
    "confidence": "medium",
    "notes": "Long range Single motor: Torque 490 Nm / 361 lbf-ft. Dual-motor 546 lbf-ft not applied."
  },
  {
    "vehicle_id": "polestar-2-single-motor-2025",
    "field": "charging.onboard_ac_kw",
    "value": 11,
    "tier": "S",
    "source_name": "Polestar UK Polestar 2 specifications: 11 kW AC charging (long range)",
    "source_url": "https://www.polestar.com/uk/polestar-2/specifications/",
    "access_date": "2026-10-03",
    "confidence": "medium",
    "notes": "Long range versions: 11 kW AC charging time table (3-phase 16A AC). Same UK specs page already used for 0-60 and curb. US manual charging-time article also states highest AC output 11 kW."
  },
  {
    "vehicle_id": "polestar-2-single-motor-2025",
    "field": "body.width_in",
    "value": 73.2,
    "tier": "S",
    "source_name": "Polestar UK Polestar 2 specifications: car width",
    "source_url": "https://www.polestar.com/uk/polestar-2/specifications/",
    "access_date": "2026-10-03",
    "confidence": "medium",
    "notes": "Car width 1,859 mm (73.2 in). Width including folded-out door mirrors 1,985 mm not used for this field."
  }
]
