[
  {
    "vehicle_id": "audi-q4-45-etron-2026",
    "tier": "P",
    "source_name": "EPA/DOE fueleconomy.gov vehicle record 49612 (2026 Audi Q4 45 e-tron)",
    "source_url": "https://www.fueleconomy.gov/ws/rest/vehicle/49612",
    "access_date": "2026-10-02",
    "disclosed_by_oem": true,
    "confidence": "high",
    "field": "efficiency.epa_range_mi",
    "value": 288,
    "notes": "EPA id 49612, matched model string on the vehicle record. Matches the EPA bulk file (https://www.fueleconomy.gov/feg/epadata/vehicles.csv.zip). Trim choice: Entry RWD EPA configuration (Q4 45 e-tron)."
  },
  {
    "vehicle_id": "audi-q4-45-etron-2026",
    "tier": "P",
    "source_name": "EPA/DOE fueleconomy.gov vehicle record 49612 (2026 Audi Q4 45 e-tron)",
    "source_url": "https://www.fueleconomy.gov/ws/rest/vehicle/49612",
    "access_date": "2026-10-02",
    "disclosed_by_oem": true,
    "confidence": "high",
    "field": "efficiency.epa_kwh_per_100mi",
    "value": 29.4031,
    "notes": "Wall-side, combined (EPA combE). The label rounds this. EPA id 49612, matched model string on the vehicle record. Matches the EPA bulk file (https://www.fueleconomy.gov/feg/epadata/vehicles.csv.zip). Trim choice: Entry RWD EPA configuration (Q4 45 e-tron)."
  },
  {
    "vehicle_id": "audi-q4-45-etron-2026",
    "tier": "P",
    "source_name": "EPA/DOE fueleconomy.gov vehicle record 49612 (2026 Audi Q4 45 e-tron)",
    "source_url": "https://www.fueleconomy.gov/ws/rest/vehicle/49612",
    "access_date": "2026-10-02",
    "disclosed_by_oem": true,
    "confidence": "high",
    "field": "efficiency.epa_mpge_combined",
    "value": 115,
    "notes": "EPA id 49612, matched model string on the vehicle record. Matches the EPA bulk file (https://www.fueleconomy.gov/feg/epadata/vehicles.csv.zip). Trim choice: Entry RWD EPA configuration (Q4 45 e-tron)."
  },
  {
    "vehicle_id": "audi-q4-45-etron-2026",
    "tier": "P",
    "source_name": "EPA/DOE fueleconomy.gov vehicle record 49612 (2026 Audi Q4 45 e-tron)",
    "source_url": "https://www.fueleconomy.gov/ws/rest/vehicle/49612",
    "access_date": "2026-10-02",
    "disclosed_by_oem": true,
    "confidence": "high",
    "field": "powertrain.drive_layout",
    "value": "RWD",
    "notes": "EPA 'drive' field: 'Rear-Wheel Drive'. EPA id 49612, matched model string on the vehicle record. Matches the EPA bulk file (https://www.fueleconomy.gov/feg/epadata/vehicles.csv.zip). Trim choice: Entry RWD EPA configuration (Q4 45 e-tron)."
  },
  {
    "vehicle_id": "audi-q4-45-etron-2026",
    "tier": "P",
    "source_name": "EPA/DOE fueleconomy.gov vehicle record 49612 (2026 Audi Q4 45 e-tron)",
    "source_url": "https://www.fueleconomy.gov/ws/rest/vehicle/49612",
    "access_date": "2026-10-02",
    "disclosed_by_oem": true,
    "confidence": "high",
    "field": "powertrain.epa_motor_description",
    "value": "170 kW Asynchron 3-Phase",
    "notes": "EPA 'evMotor' free text, verbatim. Not parsed into motor_count/motor_type. EPA id 49612, matched model string on the vehicle record. Matches the EPA bulk file (https://www.fueleconomy.gov/feg/epadata/vehicles.csv.zip). Trim choice: Entry RWD EPA configuration (Q4 45 e-tron)."
  },
  {
    "vehicle_id": "audi-q4-45-etron-2026",
    "field": "recalls.campaign_count",
    "value": 1,
    "tier": "P",
    "source_name": "NHTSA Recalls API recallsByVehicle (AUDI Q4 E-TRON, MY2026)",
    "source_url": "https://api.nhtsa.gov/recalls/recallsByVehicle?make=AUDI&model=Q4%20E-TRON&modelYear=2026",
    "access_date": "2026-10-02",
    "confidence": "high",
    "notes": "Distinct NHTSA campaigns returned for MY2026 using model string Q4 E-TRON (bare Q4 timed out / unmatched in this pass). Not trim-filtered."
  },
  {
    "vehicle_id": "audi-q4-45-etron-2026",
    "field": "recalls.campaign_25V638",
    "value": "SEAT BELTS:FRONT:RETRACTOR: The torsion bar in one or both front seat belt retractors may have been damaged during production.",
    "tier": "P",
    "source_name": "NHTSA Recalls API recallsByVehicle (AUDI Q4 E-TRON, MY2026)",
    "source_url": "https://api.nhtsa.gov/recalls/recallsByVehicle?make=AUDI&model=Q4%20E-TRON&modelYear=2026",
    "access_date": "2026-10-02",
    "confidence": "high",
    "notes": "NHTSA campaign 25V638000. Scope includes certain 2026 Q4 E-Tron and Q4 Sportback E-Tron among other VW Group models. Not trim-filtered."
  },
  {
    "vehicle_id": "audi-q4-45-etron-2026",
    "field": "identity.msrp_usd",
    "value": 50600,
    "tier": "P",
    "source_name": "Audi USA 2026 Q4 e-tron model page: starting MSRP",
    "source_url": "https://www.audiusa.com/en/models/q4/q4-e-tron/",
    "access_date": "2026-10-02",
    "disclosed_by_oem": true,
    "confidence": "high",
    "notes": "Starting at $50,600 for the 2026 Q4 e-tron lineup; page highlights Q4 45 e-tron EPA range 288 mi as the entry figure."
  },
  {
    "vehicle_id": "audi-q4-45-etron-2026",
    "field": "battery.pack_kwh",
    "value": 82,
    "tier": "P",
    "source_name": "Audi USA 2026 Q4 e-tron model page: 82 kWh battery",
    "source_url": "https://www.audiusa.com/en/models/q4/q4-e-tron/",
    "access_date": "2026-10-02",
    "disclosed_by_oem": true,
    "confidence": "high",
    "notes": "Page: '82 kWh battery' for the Q4 e-tron. Gross vs usable not labeled."
  },
  {
    "vehicle_id": "audi-q4-45-etron-2026",
    "field": "battery.pack_kwh_basis",
    "value": "unstated",
    "tier": "P",
    "source_name": "Audi USA 2026 Q4 e-tron model page: 82 kWh battery",
    "source_url": "https://www.audiusa.com/en/models/q4/q4-e-tron/",
    "access_date": "2026-10-02",
    "disclosed_by_oem": true,
    "confidence": "high",
    "notes": "OEM states 82 kWh without gross/usable label."
  },
  {
    "vehicle_id": "audi-q4-45-etron-2026",
    "field": "charging.peak_dc_kw",
    "value": 175,
    "tier": "P",
    "source_name": "Audi USA 2026 Q4 e-tron model page: up to 175 kW DC fast charging",
    "source_url": "https://www.audiusa.com/en/models/q4/q4-e-tron/",
    "access_date": "2026-10-02",
    "disclosed_by_oem": true,
    "confidence": "high",
    "notes": "Page: up to 175 kW DC fast-charging speeds. Also states about 28 min for 10-80% at a public DC fast charger."
  },
  {
    "vehicle_id": "audi-q4-45-etron-2026",
    "field": "powertrain.power_hp",
    "value": 282,
    "tier": "P",
    "source_name": "Audi USA 2026 Q4 e-tron model page: Q4 45 e-tron horsepower",
    "source_url": "https://www.audiusa.com/en/models/q4/q4-e-tron/",
    "access_date": "2026-10-02",
    "disclosed_by_oem": true,
    "confidence": "high",
    "notes": "Q4 45 e-tron: 282 HP with rear-wheel drive (SAE peak conditions caveats on page)."
  },
  {
    "vehicle_id": "audi-q4-45-etron-2026",
    "field": "body.curb_weight_lb",
    "value": 4564,
    "tier": "P",
    "source_name": "Audi Media Center technical data: Q4 45 e-tron 210 kW unladen weight (status 2026-02-02)",
    "source_url": "https://uploads.audi-mediacenter.com/system/production/car_motorizations/1287/file_en/886493c11136de03ce0ba8782700e6cd397f6646/eTD-Audi-Q4-45-e-tron-210kW_260202.pdf?1770133565=&disposition=attachment",
    "access_date": "2026-10-02",
    "disclosed_by_oem": true,
    "confidence": "medium",
    "notes": "Sheet lists unladen weight without driver 2,070 kg (4,563.6 lb); recorded as 4,564 lb after rounding. Germany program sheet; EU unladen-without-driver definition, not a US curb-weight label. Audi USA model page does not publish curb weight."
  }
]
