[
  {
    "vehicle_id": "genesis-gv60-rwd-2026",
    "tier": "P",
    "source_name": "EPA/DOE fueleconomy.gov vehicle record 49652 (2026 2026 Genesis GV60 RWD)",
    "source_url": "https://www.fueleconomy.gov/ws/rest/vehicle/49652",
    "access_date": "2026-10-02",
    "disclosed_by_oem": true,
    "confidence": "high",
    "field": "efficiency.epa_range_mi",
    "value": 306,
    "notes": "EPA id 49652, '2026 Genesis GV60 RWD'. Matches the EPA bulk file (https://www.fueleconomy.gov/feg/epadata/vehicles.csv.zip). Trim choice: Entry RWD EPA configuration.."
  },
  {
    "vehicle_id": "genesis-gv60-rwd-2026",
    "tier": "P",
    "source_name": "EPA/DOE fueleconomy.gov vehicle record 49652 (2026 2026 Genesis GV60 RWD)",
    "source_url": "https://www.fueleconomy.gov/ws/rest/vehicle/49652",
    "access_date": "2026-10-02",
    "disclosed_by_oem": true,
    "confidence": "high",
    "field": "efficiency.epa_kwh_per_100mi",
    "value": 30.5687,
    "notes": "Wall-side, combined (EPA combE). The label rounds this. EPA id 49652, '2026 Genesis GV60 RWD'. Matches the EPA bulk file (https://www.fueleconomy.gov/feg/epadata/vehicles.csv.zip). Trim choice: Entry RWD EPA configuration.."
  },
  {
    "vehicle_id": "genesis-gv60-rwd-2026",
    "tier": "P",
    "source_name": "EPA/DOE fueleconomy.gov vehicle record 49652 (2026 2026 Genesis GV60 RWD)",
    "source_url": "https://www.fueleconomy.gov/ws/rest/vehicle/49652",
    "access_date": "2026-10-02",
    "disclosed_by_oem": true,
    "confidence": "high",
    "field": "efficiency.epa_mpge_combined",
    "value": 110,
    "notes": "EPA id 49652, '2026 Genesis GV60 RWD'. Matches the EPA bulk file (https://www.fueleconomy.gov/feg/epadata/vehicles.csv.zip). Trim choice: Entry RWD EPA configuration.."
  },
  {
    "vehicle_id": "genesis-gv60-rwd-2026",
    "tier": "P",
    "source_name": "EPA/DOE fueleconomy.gov vehicle record 49652 (2026 2026 Genesis GV60 RWD)",
    "source_url": "https://www.fueleconomy.gov/ws/rest/vehicle/49652",
    "access_date": "2026-10-02",
    "disclosed_by_oem": true,
    "confidence": "high",
    "field": "powertrain.drive_layout",
    "value": "RWD",
    "notes": "EPA 'drive' field mapped to RWD. EPA id 49652, '2026 Genesis GV60 RWD'. Matches the EPA bulk file (https://www.fueleconomy.gov/feg/epadata/vehicles.csv.zip). Trim choice: Entry RWD EPA configuration.."
  },
  {
    "vehicle_id": "genesis-gv60-rwd-2026",
    "tier": "P",
    "source_name": "EPA/DOE fueleconomy.gov vehicle record 49652 (2026 2026 Genesis GV60 RWD)",
    "source_url": "https://www.fueleconomy.gov/ws/rest/vehicle/49652",
    "access_date": "2026-10-02",
    "disclosed_by_oem": true,
    "confidence": "high",
    "field": "powertrain.epa_motor_description",
    "value": "168 kW PMSM",
    "notes": "EPA 'evMotor' free text, verbatim. Not parsed into motor_count/motor_type. EPA id 49652, '2026 Genesis GV60 RWD'. Matches the EPA bulk file (https://www.fueleconomy.gov/feg/epadata/vehicles.csv.zip). Trim choice: Entry RWD EPA configuration.."
  },
  {
    "vehicle_id": "genesis-gv60-rwd-2026",
    "field": "recalls.campaign_count",
    "value": 1,
    "tier": "P",
    "source_name": "NHTSA Recalls API recallsByVehicle (GENESIS GV60, MY2026)",
    "source_url": "https://api.nhtsa.gov/recalls/recallsByVehicle?make=GENESIS&model=GV60&modelYear=2026",
    "access_date": "2026-10-02",
    "confidence": "high",
    "notes": "Distinct NHTSA campaigns returned for MY2026 (make/model/year query; not filtered by trim)."
  },
  {
    "vehicle_id": "genesis-gv60-rwd-2026",
    "field": "recalls.campaign_26V019",
    "value": "ELECTRICAL SYSTEM:INSTRUMENT CLUSTER/PANEL: Due to a software error, the instrument panel display may fail.",
    "tier": "P",
    "source_name": "NHTSA Recalls API recallsByVehicle (GENESIS GV60, MY2026)",
    "source_url": "https://api.nhtsa.gov/recalls/recallsByVehicle?make=GENESIS&model=GV60&modelYear=2026",
    "access_date": "2026-10-02",
    "confidence": "high",
    "notes": "NHTSA campaign 26V019000. Scope includes certain Genesis 2026 GV60 vehicles among other Genesis models. Not trim-filtered."
  },
  {
    "vehicle_id": "genesis-gv60-rwd-2026",
    "field": "identity.msrp_usd",
    "value": 52525,
    "tier": "P",
    "source_name": "Genesis USA offers page: 2026 GV60 RWD starting MSRP",
    "source_url": "https://org-us.genesis.com/us/en/offers/gv60",
    "access_date": "2026-10-02",
    "disclosed_by_oem": true,
    "confidence": "high",
    "notes": "Listed as 2026 GV60 RWD starting MSRP $52,525. Live product page later shows 2027 pricing separately."
  },
  {
    "vehicle_id": "genesis-gv60-rwd-2026",
    "field": "battery.pack_kwh",
    "value": 84,
    "tier": "P",
    "source_name": "Genesis USA GV60 page: 84 kWh battery / EPA range up to 306 miles",
    "source_url": "https://www.genesis.com/us/en/gv60",
    "access_date": "2026-10-02",
    "disclosed_by_oem": true,
    "confidence": "medium",
    "model_year": 2027,
    "notes": "Page currently titled 2027 GV60 but states 84 kWh battery and up to 306 miles EPA range, matching EPA id 49652 for MY2026 RWD. Gross vs usable not labeled."
  },
  {
    "vehicle_id": "genesis-gv60-rwd-2026",
    "field": "battery.pack_kwh_basis",
    "value": "unstated",
    "tier": "P",
    "source_name": "Genesis USA GV60 page: 84 kWh battery / EPA range up to 306 miles",
    "source_url": "https://www.genesis.com/us/en/gv60",
    "access_date": "2026-10-02",
    "disclosed_by_oem": true,
    "confidence": "medium",
    "model_year": 2027,
    "notes": "OEM states '84 kWh battery' without gross/usable label."
  },
  {
    "vehicle_id": "genesis-gv60-rwd-2026",
    "field": "charging.port_type",
    "value": "NACS",
    "tier": "P",
    "source_name": "Genesis USA GV60 page: built-in NACS port",
    "source_url": "https://www.genesis.com/us/en/gv60",
    "access_date": "2026-10-02",
    "disclosed_by_oem": true,
    "confidence": "medium",
    "model_year": 2027,
    "notes": "Page: built-in NACS port for Supercharger access. Live page labeled 2027; applied to atlas MY2026 RWD as OEM currently presents NACS as standard on GV60."
  },
  {
    "vehicle_id": "genesis-gv60-rwd-2026",
    "field": "charging.peak_dc_kw",
    "value": 350,
    "tier": "P",
    "source_name": "Genesis USA GV60 page: 350 kW / 800V ultra-fast charging",
    "source_url": "https://www.genesis.com/us/en/gv60",
    "access_date": "2026-10-02",
    "disclosed_by_oem": true,
    "confidence": "medium",
    "model_year": 2027,
    "notes": "Page: charge 10% to 80% in as little as 18 minutes when using a 350kW/800V DC Ultra-Fast Charger. Live page labeled 2027; applied to atlas MY2026 RWD as the OEM charging claim currently presented for GV60. Peak is the charger class the OEM pairs with that time, not an independently instrumented vehicle curve."
  },
  {
    "vehicle_id": "genesis-gv60-rwd-2026",
    "field": "body.curb_weight_lb",
    "value": 4515,
    "tier": "S",
    "source_name": "Kelley Blue Book: 2026 Genesis GV60 Standard dimensions (RWD)",
    "source_url": "https://www.kbb.com/genesis/gv60/2026/standard/",
    "access_date": "2026-10-02",
    "confidence": "medium",
    "notes": "KBB lists curb weight 4,515 lbs for 2026 GV60 Standard with RWD. Matches atlas RWD entry trim. Genesis USA page and the 2026 GV60 spec sheet opened in this pass did not expose a curb-weight figure in the readable text."
  },
  {
    "vehicle_id": "genesis-gv60-rwd-2026",
    "field": "powertrain.power_hp",
    "value": 225,
    "tier": "P",
    "source_name": "Genesis 2026 GV60 US specification sheet PDF (RWD horsepower)",
    "source_url": "https://s7d1.scene7.com/is/content/hyundai/2026-GV60-Spec-Sheetpdf",
    "access_date": "2026-10-03",
    "disclosed_by_oem": true,
    "confidence": "high",
    "notes": "RWD: 168 kW / ~225 HP (rear 168 kW). AWD/Advanced/Performance horsepower not applied."
  },
  {
    "vehicle_id": "genesis-gv60-rwd-2026",
    "field": "powertrain.torque_lbft",
    "value": 258,
    "tier": "P",
    "source_name": "Genesis 2026 GV60 US specification sheet PDF (RWD torque)",
    "source_url": "https://s7d1.scene7.com/is/content/hyundai/2026-GV60-Spec-Sheetpdf",
    "access_date": "2026-10-03",
    "disclosed_by_oem": true,
    "confidence": "high",
    "notes": "RWD: 350 Nm / 258 lb.-ft. AWD 446 lb-ft and Performance figures not applied."
  },
  {
    "vehicle_id": "genesis-gv60-rwd-2026",
    "field": "charging.onboard_ac_kw",
    "value": 10.9,
    "tier": "P",
    "source_name": "Genesis 2026 GV60 US specification sheet PDF (on-board charger max capacity)",
    "source_url": "https://s7d1.scene7.com/is/content/hyundai/2026-GV60-Spec-Sheetpdf",
    "access_date": "2026-10-03",
    "disclosed_by_oem": true,
    "confidence": "high",
    "notes": "On-Board Charger (OBC) Max Capacity (kW): 10.9 (shown for Advanced AWD column in the OBC block; sheet presents OBC max capacity as a shared charger figure across models rather than an AWD-only option)."
  },
  {
    "vehicle_id": "genesis-gv60-rwd-2026",
    "field": "body.width_in",
    "value": 74.4,
    "tier": "P",
    "source_name": "Genesis 2026 GV60 US specification sheet PDF (overall width)",
    "source_url": "https://s7d1.scene7.com/is/content/hyundai/2026-GV60-Spec-Sheetpdf",
    "access_date": "2026-10-03",
    "disclosed_by_oem": true,
    "confidence": "high",
    "notes": "Exterior dimensions all models: Overall Width 74.4."
  }
]
